{"$id":"https://raw.githubusercontent.com/GeorgiiMakarov/LIGHTWEIGHT-XR-CONTENT-ENGINE/main/schemas/consent-receipt.schema.json","$schema":"http://json-schema.org/draft-07/schema#","additionalProperties":false,"description":"Signed evidence that the user allowed a specific template pack to compose a specific character pack. Two-axis scope: temporal (how long) x target (whom it covers). Consent classes (profile_token vs likeness_binding) are separate switches. v1.1.0: two-axis scope, consent classes.","properties":{"campaign_id":{"description":"'*' when scope.target = global.","minLength":1,"type":"string"},"character_pack_id":{"description":"The user's character pack that was bound. Never a raw face.","minLength":1,"type":"string"},"character_pack_version":{"pattern":"^\\d+\\.\\d+\\.\\d+$","type":"string"},"classes":{"additionalProperties":false,"description":"Per-class grants. profile_token = name/city (text layer). likeness_binding = character-ref composition. Never one switch.","properties":{"likeness_binding":{"type":"boolean"},"profile_token":{"type":"boolean"}},"required":["profile_token","likeness_binding"],"type":"object"},"granted_at":{"format":"date-time","type":"string"},"medium":{"default":"preview_allow","description":"How consent was captured: the Preview/Allow/Deny prompt or settings.","enum":["preview_allow","settings"]},"policy_version":{"description":"Personalization policy version this receipt was issued under.","type":"string"},"receipt_id":{"pattern":"^csr_[a-z0-9_]{1,64}$","type":"string"},"revoked_at":{"description":"Set when the user revokes. A revoked receipt invalidates future serves; past anchored impressions stay factual.","format":"date-time","type":"string"},"scope":{"additionalProperties":false,"description":"Two axes. temporal: how long the grant lasts. target: whom it covers (global = this sponsor everywhere, '*' ids).","properties":{"target":{"enum":["global","advertiser","campaign"]},"temporal":{"enum":["single_request","campaign_window","standing"]}},"required":["temporal","target"],"type":"object"},"signature":{"additionalProperties":false,"description":"Device signature over the canonical JSON of this receipt EXCLUDING the signature object itself.","properties":{"alg":{"enum":["Ed25519"]},"key_id":{"description":"Device key identifier.","type":"string"},"sig":{"description":"Base64 signature.","type":"string"}},"required":["alg","key_id","sig"],"type":"object"},"spec_version":{"const":"1.1.0"},"template_id":{"description":"'*' when scope.target = global.","pattern":"^(tpl_[a-z0-9_]{1,64}|\\*)$","type":"string"},"template_version":{"description":"'*' when scope.target = global.","pattern":"^(\\d+\\.\\d+\\.\\d+|\\*)$","type":"string"},"user_pseudonym":{"description":"Pseudonymous device/user id. No raw identity, no biometrics, no raw face leaves the device.","type":"string"},"window":{"additionalProperties":false,"description":"Time box of the consent ('только сегодня'). Serves outside the window are invalid.","properties":{"not_after":{"format":"date-time","type":"string"},"not_before":{"format":"date-time","type":"string"}},"required":["not_before","not_after"],"type":"object"}},"required":["spec_version","receipt_id","user_pseudonym","template_id","template_version","campaign_id","character_pack_id","character_pack_version","scope","classes","granted_at","window","signature"],"title":"Consent Receipt v1.1 — signed personalization consent evidence (DRAFT)","type":"object"}